{
  "schema": "notebook-pack.v1",
  "notebook": {
    "id": "mq-stack",
    "purpose": "Cross-document synthesis over reviewed MQ architecture and decisions."
  },
  "generated_at": "2026-08-25T18:30:00Z",
  "generator": {
    "name": "mq-agent",
    "version": "example"
  },
  "sources": [
    {
      "path": "systems/mqobsidian/index.md",
      "kind": "overview",
      "classification": "public-safe",
      "sha256": "aaaaaaaaaaaaaaaaaaaaaaaaaaaaaaaaaaaaaaaaaaaaaaaaaaaaaaaaaaaaaaaa",
      "revision": {
        "repository": "mqobsidian",
        "commit": "b44cfa8"
      }
    },
    {
      "path": "docs/architecture.md",
      "kind": "architecture",
      "classification": "public-safe",
      "sha256": "bbbbbbbbbbbbbbbbbbbbbbbbbbbbbbbbbbbbbbbbbbbbbbbbbbbbbbbbbbbbbbbb",
      "revision": {
        "repository": "mqobsidian",
        "commit": "b44cfa8"
      }
    }
  ],
  "content_hash": "cccccccccccccccccccccccccccccccccccccccccccccccccccccccccccccccc"
}
